{
  "allowed_registry_dns_prefixes": ["registry.example.invalid"],
  "approved_repo_digest_sha256": [],
  "caddy_roots": ["/etc/caddy/Caddyfile"],
  "collector_sha256": "4444444444444444444444444444444444444444444444444444444444444444",
  "docker_command": ["/usr/bin/docker"],
  "docker_config_path": "/etc/docker",
  "docker_socket_path": "/var/run/docker.sock",
  "expected_name_sha256": [],
  "expected_path_sha256": [],
  "inventory_nonce": "1111111111111111111111111111111111111111111111111111111111111111",
  "inventory_target_claim_sha256": "5555555555555555555555555555555555555555555555555555555555555555",
  "max_acl_bytes_per_path": 65536,
  "max_acl_entries": 256,
  "max_command_output_bytes": 1048576,
  "max_command_seconds": 30,
  "max_command_calls": 1024,
  "max_total_command_output_bytes": 33554432,
  "max_total_command_seconds": 1800,
  "max_containers": 70,
  "max_inventory_bytes": 2097152,
  "max_mounts_per_container": 64,
  "max_networks": 512,
  "max_observation_bytes": 524288,
  "max_path_bytes": 4096,
  "max_persistence_file_bytes": 536870912,
  "max_ports_per_container": 128,
  "max_recursive_entries": 250000,
  "max_topology_bytes": 1572864,
  "max_volumes": 512,
  "observed_sources": [
    {"path": "/opt", "role": "opt"},
    {"path": "/var/lib/postgresql", "role": "postgresql"},
    {"path": "/var/lib/redis", "role": "redis"}
  ],
  "request_identity_projection_sha256": "e3e35a7566e9de1f13aeaa3fe9ad08c72d9959c27b4dffdb0b579fb446cda38e",
  "request_policy_sha256": "2222222222222222222222222222222222222222222222222222222222222222",
  "schema_version": "deploydesk-docker-host-inventory-request/v2",
  "service_role_sha256": {
    "caddy": ["aaaaaaaaaaaaaaaaaaaaaaaaaaaaaaaaaaaaaaaaaaaaaaaaaaaaaaaaaaaaaaaa"],
    "redis": ["bbbbbbbbbbbbbbbbbbbbbbbbbbbbbbbbbbbbbbbbbbbbbbbbbbbbbbbbbbbbbbbb"]
  },
  "source_lock_sha256": "3333333333333333333333333333333333333333333333333333333333333333",
  "trusted_ancestor_paths": ["/var/lib"]
}
